{
  "summary": {
    "theory_count": 2,
    "model_edge_count": 13,
    "confirmed_count": 0,
    "contradicted_count": 0,
    "missing_count": 0,
    "novel_count": 13
  },
  "confirmed": [],
  "contradicted": [],
  "missing": [],
  "novel": [
    {
      "from_var": "Core Developer",
      "to_var": "Developer's Turnover",
      "relationship": "undeclared",
      "citation_key": null
    },
    {
      "from_var": "Core Developer",
      "to_var": "Implicit Knowledge Transfer (Mentorship)",
      "relationship": "positive",
      "citation_key": null
    },
    {
      "from_var": "Developer's Turnover",
      "to_var": "Core Developer",
      "relationship": "undeclared",
      "citation_key": null
    },
    {
      "from_var": "Experienced Contributors",
      "to_var": "Promotion Rate",
      "relationship": "undeclared",
      "citation_key": null
    },
    {
      "from_var": "Explicit Knowledge Transfer (Documentation, Contributor's Guides)",
      "to_var": "Skill up",
      "relationship": "undeclared",
      "citation_key": null
    },
    {
      "from_var": "Implicit Knowledge Transfer (Mentorship)",
      "to_var": "Promotion Rate",
      "relationship": "positive",
      "citation_key": null
    },
    {
      "from_var": "Implicit Knowledge Transfer (Mentorship)",
      "to_var": "Skill up",
      "relationship": "undeclared",
      "citation_key": null
    },
    {
      "from_var": "New Contributors",
      "to_var": "Skill up",
      "relationship": "undeclared",
      "citation_key": null
    },
    {
      "from_var": "Promotion Rate",
      "to_var": "Core Developer",
      "relationship": "undeclared",
      "citation_key": null
    },
    {
      "from_var": "Promotion Rate",
      "to_var": "Experienced Contributors",
      "relationship": "undeclared",
      "citation_key": null
    },
    {
      "from_var": "Skill up",
      "to_var": "Experienced Contributors",
      "relationship": "undeclared",
      "citation_key": null
    },
    {
      "from_var": "Skill up",
      "to_var": "New Contributors",
      "relationship": "undeclared",
      "citation_key": null
    },
    {
      "from_var": "colored stock",
      "to_var": "New Contributors",
      "relationship": "undeclared",
      "citation_key": null
    }
  ],
  "bibliography_loaded": false
}