{
  "summary": {
    "theory_count": 1,
    "model_edge_count": 6,
    "confirmed_count": 1,
    "contradicted_count": 0,
    "missing_count": 1,
    "novel_count": 6
  },
  "confirmed": [
    {
      "from_var": "Potential Adopters",
      "to_var": "New Adopters",
      "relationship": "positive",
      "theory": "Test Theory",
      "citation_key": "ajzen1991"
    }
  ],
  "contradicted": [],
  "missing": [
    {
      "from_var": "Market Saturation",
      "to_var": "New Adopters",
      "relationship": "negative",
      "theory": "Test Theory",
      "citation_key": "ajzen1991"
    }
  ],
  "novel": [
    {
      "from_var": "Adopters",
      "to_var": "New Adopters",
      "relationship": "unknown",
      "citation_key": null
    },
    {
      "from_var": "Adopters",
      "to_var": "Potential Adopters",
      "relationship": "unknown",
      "citation_key": null
    },
    {
      "from_var": "Adoption Rate",
      "to_var": "New Adopters",
      "relationship": "unknown",
      "citation_key": null
    },
    {
      "from_var": "Attrition",
      "to_var": "Adopters",
      "relationship": "unknown",
      "citation_key": null
    },
    {
      "from_var": "New Adopters",
      "to_var": "Adopters",
      "relationship": "unknown",
      "citation_key": null
    },
    {
      "from_var": "Potential Adopters",
      "to_var": "New Adopters",
      "relationship": "unknown",
      "citation_key": null
    }
  ],
  "bibliography_loaded": true
}